{
  "id": "encoding",
  "domain": "data",
  "question": "Quel encodage de caracteres utiliser a travers toutes les couches de l'application ?",
  "depends_on": [
    "database",
    "backend-framework"
  ],
  "tags": [
    "data",
    "encoding",
    "utf-8",
    "charset",
    "unicode"
  ],
  "classification": "universal",
  "universal": {
    "principles": [
      {
        "text": "UTF-8 partout : base de donnees, API, fichiers source, HTML. Tout autre choix cause des bugs d'affichage et des failles de securite. 98.2% du web en UTF-8 (Web Almanac 2024).",
        "grade": 6,
        "level": "STANDARD",
        "sources": [
          {
            "name": "IETF RFC 3629 — standard UTF-8",
            "pyramid": 1,
            "year": 2003
          },
          {
            "name": "W3C — UTF-8 obligatoire pour HTML5",
            "pyramid": 1,
            "year": 2024
          },
          {
            "name": "Web Almanac 2024",
            "pyramid": 4,
            "year": 2024,
            "quote": "98.2% du web en UTF-8"
          }
        ],
        "v3_review": "2026-04-14",
        "robustness": "ROBUSTE"
      }
    ]
  },
  "variants": {
    "java-spring-boot": {
      "recommendation": "server.servlet.encoding.charset: UTF-8, force: true dans application.yml. Fichiers source en UTF-8 sans BOM.",
      "grade": 7,
      "level": "STANDARD",
      "implementation": "spring.servlet.encoding.charset: UTF-8, force: true. PostgreSQL : ENCODING 'UTF8' + LC_COLLATE 'fr_FR.UTF-8'. Content-Type: application/json; charset=utf-8.",
      "sources": [
        {
          "name": "Spring Boot docs — encoding configuration",
          "pyramid": 3,
          "year": 2024
        }
      ]
    },
    "typescript-nestjs": {
      "recommendation": "Node.js utilise UTF-8 par defaut. S'assurer que PostgreSQL est en UTF8 et que les reponses HTTP incluent charset=utf-8.",
      "grade": 7,
      "level": "STANDARD",
      "implementation": "Node.js gere UTF-8 nativement. Verifier Content-Type headers. PostgreSQL : ENCODING 'UTF8'.",
      "sources": [
        {
          "name": "Node.js docs — Buffer encoding",
          "pyramid": 3,
          "year": 2024
        }
      ]
    },
    "python-django": {
      "recommendation": "Python 3 utilise UTF-8 par defaut pour les strings. DEFAULT_CHARSET = 'utf-8' dans Django (defaut). PostgreSQL en UTF8.",
      "grade": 7,
      "level": "STANDARD",
      "implementation": "Python 3 strings = Unicode nativement. Django DEFAULT_CHARSET = 'utf-8' (defaut). FILE_CHARSET = 'utf-8'.",
      "sources": [
        {
          "name": "Django docs — DEFAULT_CHARSET",
          "pyramid": 3,
          "year": 2024
        },
        {
          "name": "Python 3 docs — Unicode HOWTO",
          "pyramid": 3,
          "year": 2024
        }
      ]
    }
  }
}
